{
  "run_id": "c2-mini-triage-context__tenant-cache-scope",
  "candidate_id": "c2",
  "task_id": "tenant-cache-scope",
  "model_mapping": {
    "triage": {
      "model": "gpt-5.4-mini",
      "effort": "medium"
    },
    "execution": {
      "model": "gpt-5.4",
      "effort": "xhigh"
    }
  },
  "review_model": {
    "model": "gpt-5.4",
    "effort": "high"
  },
  "changed_files": [
    "app/cache_keys.py",
    "app/project_summary_service.py",
    "docs/caching.md",
    "docs/multi-tenant-architecture.md",
    "tests/test_tenant_cache_scope.py"
  ],
  "gate_results": {
    "tests_pass": true,
    "compile_pass": true,
    "docs_sync_check": true
  },
  "review_results": {
    "high": 0,
    "medium": 0,
    "low": 1
  },
  "failure_taxonomy": [],
  "usage": {
    "candidate": {
      "triage_usage": {
        "input_tokens": 622152,
        "cached_input_tokens": 554880,
        "output_tokens": 7862
      },
      "execution_usage": {
        "input_tokens": 1032509,
        "cached_input_tokens": 960384,
        "output_tokens": 9184
      }
    },
    "review": {
      "input_tokens": 415621,
      "cached_input_tokens": 347904,
      "output_tokens": 3948
    }
  },
  "result": "pass"
}