{
  "run_id": "c0-gpt54mini-high__tenant-cache-scope",
  "candidate_id": "c0",
  "task_id": "tenant-cache-scope",
  "model_mapping": {
    "solo": {
      "model": "gpt-5.4-mini",
      "effort": "high"
    }
  },
  "review_model": {
    "model": "gpt-5.4",
    "effort": "high"
  },
  "changed_files": [
    "app/cache_keys.py",
    "app/project_summary_service.py",
    "docs/caching.md",
    "docs/multi-tenant-architecture.md",
    "tests/test_tenant_cache_scope.py"
  ],
  "gate_results": {
    "tests_pass": true,
    "compile_pass": true,
    "docs_sync_check": true
  },
  "review_results": {
    "high": 1,
    "medium": 0,
    "low": 0
  },
  "failure_taxonomy": [],
  "usage": {
    "candidate": {
      "solo_usage": {
        "input_tokens": 1372249,
        "cached_input_tokens": 1215744,
        "output_tokens": 14404
      }
    },
    "review": {
      "input_tokens": 772428,
      "cached_input_tokens": 703104,
      "output_tokens": 4661
    }
  },
  "result": "fail"
}